{"id":"maltese","name":"Maltese","aliases":[],"group":"toy","origin":"Malta","lifespan":"12-15 years","size":{"height_cm":"20-25","weight_kg":"2-4","category":"tiny"},"ratings":{"size":1,"energy":3,"grooming":5,"sociability":4,"trainability":3,"barking":4,"kid_friendly":3,"apartment_ok":5},"characteristics":{"coat_type":"Long, silky, white coat","coat_colors":["white"],"shedding":"minimal","hypoallergenic":true},"temperament":["gentle","playful","affectionate","charming","fearless","trusting"],"description":{"overview":"Maltese are elegant toy dogs with flowing white coats. They've been lap dogs of royalty for centuries and remain popular companions today.","temperament":"Maltese are gentle and affectionate but surprisingly fearless. They love their people and enjoy being pampered.","health":"Prone to dental issues, luxating patella, liver shunts, and collapsed trachea. Regular dental care essential.","exercise":"Low to moderate exercise needs. Short walks and indoor play. Good for apartments."},"verdict":{"best_for":["Apartment dwellers","Seniors","Those wanting a glamorous small dog","Allergy sufferers","People who enjoy grooming"],"not_for":["Families with small children","Those who dislike grooming","Outdoor enthusiasts","People wanting a rugged dog"],"summary":"Elegant, affectionate lap dogs perfect for apartment living. Maltese need daily grooming but are hypoallergenic. Best for adults who can handle them gently and enjoy pampering."}}