{"id":"shiba-inu","name":"Shiba Inu","aliases":["Shiba"],"group":"non-sporting","origin":"Japan","lifespan":"13-16 years","size":{"height_cm":"33-43","weight_kg":"8-11","category":"small"},"ratings":{"size":2,"energy":4,"grooming":3,"sociability":2,"trainability":2,"barking":3,"kid_friendly":3,"apartment_ok":4},"characteristics":{"coat_type":"Thick double coat","coat_colors":["red","sesame","black and tan","cream"],"shedding":"heavy","hypoallergenic":false},"temperament":["alert","active","attentive","charming","confident","independent"],"description":{"overview":"Shiba Inus are ancient Japanese dogs known for their fox-like appearance and cat-like independence. They're bold, confident, and popular worldwide.","temperament":"Shibas are independent and cat-like. They're loyal but not clingy. Can be aloof with strangers and don't always get along with other dogs.","health":"Generally healthy. Watch for allergies, hip dysplasia, and eye problems.","exercise":"Moderate to high exercise needs. Need daily activity but aren't as demanding as some breeds."},"verdict":{"best_for":["Those who appreciate independence","Apartment dwellers who exercise them","Experienced dog owners","Those wanting a clean, cat-like dog"],"not_for":["First-time owners","Those wanting a clingy dog","Multi-dog households","Off-leash enthusiasts"],"summary":"Independent, fox-like dogs with cat-like personalities. Shibas are clean and charming but stubborn. Best for experienced owners who appreciate their independent nature. Not cuddly lap dogs."}}