{
  "id": "pharaoh-hound",
  "name": "Pharaoh Hound",
  "aliases": [
    "Kelb tal-Fenek",
    "Rabbit Dog"
  ],
  "group": "hound",
  "origin": "Malta",
  "lifespan": "12-14 years",
  "size": {
    "height_cm": "53-63",
    "weight_kg": "20-25",
    "category": "medium"
  },
  "ratings": {
    "size": 3,
    "energy": 4,
    "grooming": 1,
    "sociability": 4,
    "trainability": 3,
    "barking": 3,
    "kid_friendly": 4,
    "apartment_ok": 3
  },
  "characteristics": {
    "coat_type": "Short, glossy",
    "coat_colors": [
      "tan",
      "rich tan",
      "chestnut"
    ],
    "shedding": "minimal",
    "hypoallergenic": false
  },
  "temperament": [
    "affectionate",
    "playful",
    "intelligent",
    "noble",
    "friendly",
    "active"
  ],
  "description": {
    "overview": "The Pharaoh Hound is Malta's national dog, known for 'blushing' (nose and ears turn deep rose when excited).",
    "temperament": "Pharaoh Hounds are friendly, affectionate, and playful. They're good with children and other dogs.",
    "health": "Generally healthy. May be prone to sensitivity to anesthesia.",
    "exercise": "High energy. Need daily exercise and secure areas to run."
  },
  "verdict": {
    "best_for": [
      "Active families",
      "Those wanting a unique, friendly dog",
      "Homes with older children",
      "Owners who can provide exercise"
    ],
    "not_for": [
      "Homes with small pets",
      "Cold climates",
      "Those wanting off-leash reliability",
      "Sedentary households"
    ],
    "summary": "Elegant, friendly sighthounds that actually blush! Pharaoh Hounds are playful and affectionate. Need active owners and secure running space."
  }
}