{
  "id": "english-toy-spaniel",
  "name": "English Toy Spaniel",
  "aliases": [],
  "group": "toy",
  "origin": "England",
  "lifespan": "10-12 years",
  "size": {
    "height_cm": "25-27",
    "weight_kg": "3.5-6.5",
    "category": "small"
  },
  "ratings": {
    "size": 2,
    "energy": 2,
    "grooming": 3,
    "sociability": 4,
    "trainability": 3,
    "barking": 2,
    "kid_friendly": 4,
    "apartment_ok": 5
  },
  "characteristics": {
    "coat_type": "Long, silky, wavy",
    "coat_colors": [
      "blenheim",
      "prince charles",
      "king charles",
      "ruby"
    ],
    "shedding": "moderate",
    "hypoallergenic": false
  },
  "temperament": [
    "gentle",
    "happy",
    "playful",
    "loving",
    "quiet"
  ],
  "description": {
    "overview": "Not to be confused with the Cavalier, the English Toy Spaniel (King Charles Spaniel in the UK) is smaller with a domed head. They're gentle, devoted lapdogs.",
    "history": "The English Toy Spaniel originated in England.",
    "temperament": "Known for being gentle, happy, playful.",
    "health": "Generally healthy with breed-typical considerations.",
    "grooming": "Requires regular grooming appropriate for their long, silky, wavy coat.",
    "exercise": "Exercise needs match their energy level."
  },
  "verdict": {
    "best_for": [
      "Apartment dwellers",
      "Seniors",
      "Those wanting a quiet companion"
    ],
    "not_for": [
      "Active families",
      "Outdoor enthusiasts"
    ],
    "summary": "Not to be confused with the Cavalier, the English Toy Spaniel (King Charles Spaniel in the UK) is smaller with a domed head. They're gentle, devoted lapdogs."
  }
}