{"id":"havanese","name":"Havanese","aliases":["Havana Silk Dog"],"group":"toy","origin":"Cuba","lifespan":"14-16 years","size":{"height_cm":"21-29","weight_kg":"3-6","category":"small"},"ratings":{"size":1,"energy":3,"grooming":4,"sociability":5,"trainability":4,"barking":2,"kid_friendly":5,"apartment_ok":5},"characteristics":{"coat_type":"Long, silky, wavy coat","coat_colors":["all colors"],"shedding":"minimal","hypoallergenic":true},"temperament":["intelligent","outgoing","funny","happy","affectionate","playful"],"description":{"overview":"The Havanese is Cuba's national dog. They're cheerful, intelligent, and make wonderful companions. Known for their springy gait and silky coat.","temperament":"Havanese are happy, outgoing dogs who love everyone. They're intelligent and eager to please. Great with children and other pets.","health":"Generally healthy but watch for eye problems, luxating patella, and hip dysplasia.","exercise":"Moderate exercise needs. Playful and enjoy activities with their owners. Good for apartment living."},"verdict":{"best_for":["Families with children","Apartment dwellers","Allergy sufferers","First-time owners","Those wanting a cheerful companion"],"not_for":["Those who dislike grooming","People away from home often","Those wanting a guard dog"],"summary": "Cheerful, intelligent, and hypoallergenic. Havanese are wonderful family dogs that do well in apartments. Need regular grooming but don't shed much. Great first-time dog."}}