{"id":"brittany","name":"Brittany","aliases":["Brittany Spaniel","Epagneul Breton"],"group":"sporting","origin":"France","lifespan":"12-14 years","size":{"height_cm":"44-52","weight_kg":"14-18","category":"medium"},"ratings":{"size":3,"energy":5,"grooming":2,"sociability":4,"trainability":5,"barking":3,"kid_friendly":4,"apartment_ok":1},"characteristics":{"coat_type":"Medium-length, wavy coat","coat_colors":["orange and white","liver and white","tricolor"],"shedding":"moderate","hypoallergenic":false},"temperament":["bright","fun-loving","upbeat","agile","adaptable","eager"],"description":{"overview":"Brittanys are versatile hunting dogs and excellent family companions. They're energetic, friendly, and eager to please.","temperament":"Brittanys are bright, eager, and sensitive. They respond well to positive training and love being with their families.","health":"Generally healthy. Watch for hip dysplasia and epilepsy. Regular vet checkups recommended.","exercise":"Very high exercise needs. Need vigorous daily activity. Excel at field trials and hunt tests."},"verdict":{"best_for":["Active families","Hunters","Dog sport enthusiasts","Rural/suburban living","Those with yards"],"not_for":["Apartment dwellers","Sedentary lifestyles","First-time owners unprepared for high energy","Those away from home often"],"summary":"High-energy hunting dogs that need lots of exercise and activity. Brittanys are sweet, eager to please, and great family dogs—if you can keep up with them."}}